{
  "schemaVersion": 2,
  "model": {
    "name": "lucky-party-detector",
    "version": "mock-1"
  },
  "roleSnapshotVersion": "20261006000000",
  "generatedAt": "2026-10-06T03:20:37.109207Z",
  "frames": [
    {
      "frameId": "round-01-map-01",
      "frameNumber": 0,
      "capturedAt": "2026-10-06T00:00:00Z",
      "image": {
        "width": 1920,
        "height": 1080
      },
      "predictions": [
        {
          "detectionId": "round-01-map-01-round-0",
          "label": "round_slot",
          "confidence": 0.957,
          "bbox": [650, 25, 735, 75],
          "attributes": {
            "value": "1",
            "index": 0
          }
        },
        {
          "detectionId": "round-01-map-01-round-1",
          "label": "round_slot",
          "confidence": 0.9294,
          "bbox": [750, 25, 835, 75],
          "attributes": {
            "value": "2",
            "index": 1
          }
        },
        {
          "detectionId": "round-01-map-01-round-2",
          "label": "round_slot",
          "confidence": 0.9704,
          "bbox": [850, 25, 935, 75],
          "attributes": {
            "value": "3",
            "index": 2
          }
        },
        {
          "detectionId": "round-01-map-01-round-3",
          "label": "round_slot",
          "confidence": 0.8389,
          "bbox": [950, 25, 1035, 75],
          "attributes": {
            "value": "4",
            "index": 3
          }
        },
        {
          "detectionId": "round-01-map-01-round-4",
          "label": "round_slot",
          "confidence": 0.8341,
          "bbox": [1050, 25, 1135, 75],
          "attributes": {
            "value": "5",
            "index": 4
          }
        },
        {
          "detectionId": "round-01-map-01-round-5",
          "label": "round_slot",
          "confidence": 0.9207,
          "bbox": [1150, 25, 1235, 75],
          "attributes": {
            "value": "6",
            "index": 5
          }
        },
        {
          "detectionId": "round-01-map-01-die-0",
          "label": "board_die",
          "confidence": 0.835,
          "bbox": [650, 175, 920, 455],
          "attributes": {
            "index": 0,
            "value": "1"
          }
        },
        {
          "detectionId": "round-01-map-01-die-1",
          "label": "board_die",
          "confidence": 0.8424,
          "bbox": [990, 175, 1260, 455],
          "attributes": {
            "index": 1,
            "value": "4"
          }
        },
        {
          "detectionId": "round-01-map-01-character",
          "label": "map_character",
          "confidence": 0.9855,
          "bbox": [870, 410, 1080, 760],
          "attributes": {
            "value": "115"
          }
        }
      ]
    },
    {
      "frameId": "round-01-map-02",
      "frameNumber": 1,
      "capturedAt": "2026-10-06T00:00:03Z",
      "image": {
        "width": 1920,
        "height": 1080
      },
      "predictions": [
        {
          "detectionId": "round-01-map-02-round-0",
          "label": "round_slot",
          "confidence": 0.8305,
          "bbox": [650, 25, 735, 75],
          "attributes": {
            "value": "1",
            "index": 0
          }
        },
        {
          "detectionId": "round-01-map-02-round-1",
          "label": "round_slot",
          "confidence": 0.9445,
          "bbox": [750, 25, 835, 75],
          "attributes": {
            "value": "2",
            "index": 1
          }
        },
        {
          "detectionId": "round-01-map-02-round-2",
          "label": "round_slot",
          "confidence": 0.9866,
          "bbox": [850, 25, 935, 75],
          "attributes": {
            "value": "3",
            "index": 2
          }
        },
        {
          "detectionId": "round-01-map-02-round-3",
          "label": "round_slot",
          "confidence": 0.9048,
          "bbox": [950, 25, 1035, 75],
          "attributes": {
            "value": "4",
            "index": 3
          }
        },
        {
          "detectionId": "round-01-map-02-round-4",
          "label": "round_slot",
          "confidence": 0.8825,
          "bbox": [1050, 25, 1135, 75],
          "attributes": {
            "value": "5",
            "index": 4
          }
        },
        {
          "detectionId": "round-01-map-02-round-5",
          "label": "round_slot",
          "confidence": 0.9746,
          "bbox": [1150, 25, 1235, 75],
          "attributes": {
            "value": "null",
            "index": 5
          }
        },
        {
          "detectionId": "round-01-map-02-die-0",
          "label": "board_die",
          "confidence": 0.9346,
          "bbox": [650, 175, 920, 455],
          "attributes": {
            "index": 0,
            "value": "4"
          }
        },
        {
          "detectionId": "round-01-map-02-character",
          "label": "map_character",
          "confidence": 0.969,
          "bbox": [870, 410, 1080, 760],
          "attributes": {
            "value": "102"
          }
        }
      ]
    },
    {
      "frameId": "round-01-map-03",
      "frameNumber": 2,
      "capturedAt": "2026-10-06T00:00:06Z",
      "image": {
        "width": 1920,
        "height": 1080
      },
      "predictions": [
        {
          "detectionId": "round-01-map-03-round-0",
          "label": "round_slot",
          "confidence": 0.8271,
          "bbox": [650, 25, 735, 75],
          "attributes": {
            "value": "1",
            "index": 0
          }
        },
        {
          "detectionId": "round-01-map-03-round-1",
          "label": "round_slot",
          "confidence": 0.9634,
          "bbox": [750, 25, 835, 75],
          "attributes": {
            "value": "2",
            "index": 1
          }
        },
        {
          "detectionId": "round-01-map-03-round-2",
          "label": "round_slot",
          "confidence": 0.8497,
          "bbox": [850, 25, 935, 75],
          "attributes": {
            "value": "3",
            "index": 2
          }
        },
        {
          "detectionId": "round-01-map-03-round-3",
          "label": "round_slot",
          "confidence": 0.9584,
          "bbox": [950, 25, 1035, 75],
          "attributes": {
            "value": "4",
            "index": 3
          }
        },
        {
          "detectionId": "round-01-map-03-round-4",
          "label": "round_slot",
          "confidence": 0.9388,
          "bbox": [1050, 25, 1135, 75],
          "attributes": {
            "value": "5",
            "index": 4
          }
        },
        {
          "detectionId": "round-01-map-03-round-5",
          "label": "round_slot",
          "confidence": 0.9622,
          "bbox": [1150, 25, 1235, 75],
          "attributes": {
            "value": "6",
            "index": 5
          }
        },
        {
          "detectionId": "round-01-map-03-die-0",
          "label": "board_die",
          "confidence": 0.8524,
          "bbox": [650, 175, 920, 455],
          "attributes": {
            "index": 0,
            "value": "8"
          }
        },
        {
          "detectionId": "round-01-map-03-character",
          "label": "map_character",
          "confidence": 0.907,
          "bbox": [870, 410, 1080, 760],
          "attributes": {
            "value": "109"
          }
        }
      ]
    },
    {
      "frameId": "round-01-map-04",
      "frameNumber": 3,
      "capturedAt": "2026-10-06T00:00:09Z",
      "image": {
        "width": 1920,
        "height": 1080
      },
      "predictions": [
        {
          "detectionId": "round-01-map-04-round-0",
          "label": "round_slot",
          "confidence": 0.9764,
          "bbox": [650, 25, 735, 75],
          "attributes": {
            "value": "1",
            "index": 0
          }
        },
        {
          "detectionId": "round-01-map-04-round-1",
          "label": "round_slot",
          "confidence": 0.8396,
          "bbox": [750, 25, 835, 75],
          "attributes": {
            "value": "2",
            "index": 1
          }
        },
        {
          "detectionId": "round-01-map-04-round-2",
          "label": "round_slot",
          "confidence": 0.8386,
          "bbox": [850, 25, 935, 75],
          "attributes": {
            "value": "null",
            "index": 2
          }
        },
        {
          "detectionId": "round-01-map-04-round-3",
          "label": "round_slot",
          "confidence": 0.9046,
          "bbox": [950, 25, 1035, 75],
          "attributes": {
            "value": "4",
            "index": 3
          }
        },
        {
          "detectionId": "round-01-map-04-round-4",
          "label": "round_slot",
          "confidence": 0.9144,
          "bbox": [1050, 25, 1135, 75],
          "attributes": {
            "value": "5",
            "index": 4
          }
        },
        {
          "detectionId": "round-01-map-04-round-5",
          "label": "round_slot",
          "confidence": 0.8324,
          "bbox": [1150, 25, 1235, 75],
          "attributes": {
            "value": "-1",
            "index": 5
          }
        },
        {
          "detectionId": "round-01-map-04-die-0",
          "label": "board_die",
          "confidence": 0.9239,
          "bbox": [650, 175, 920, 455],
          "attributes": {
            "index": 0,
            "value": "10"
          }
        },
        {
          "detectionId": "round-01-map-04-character",
          "label": "map_character",
          "confidence": 0.9808,
          "bbox": [870, 410, 1080, 760],
          "attributes": {
            "value": "118"
          }
        }
      ]
    },
    {
      "frameId": "round-01-battle-01",
      "frameNumber": 4,
      "capturedAt": "2026-10-06T00:00:12Z",
      "image": {
        "width": 1920,
        "height": 1080
      },
      "predictions": [
        {